Senator John Hoeven,"As Maj. Gen. Spellmon’s nomination to serve as Chief of the @USACEHQ moves through the Senate, spoke w/ him to ensure he is up-to-date on all #ND #floodprotection efforts and I look forward to working with him to advance critical projects. https://t.co/QuqUX8YsDl",2020-06-24 09:49:17.592544
Shelley Moore Capito,"NEWS: Mon General is receiving a $283,396 #telehealth grant to help build out a digital platform so patients can have appointments from their homes. More info: https://t.co/OguxMlNvEU #CapitoConnect https://t.co/zg2tWHg1ia",2020-06-24 09:54:58.583899
Lindsey Graham,"Justice.  

Finally justice.

Justice delayed is better than no justice.  

https://t.co/pU0lrLtWLa",2020-06-24 09:55:32.782530
Marco Rubio,"Addressing the impediments already facing Black-owned &amp; minority businesses is a major focus of our work on the next phase of help for #smallbusiness 

https://t.co/XY9WefMUqj",2020-06-24 10:04:28.371140
Steve Daines,"https://t.co/l6DBh9e4eO
Totally agree, @realDonaldTrump. We must pass my constitutional amendment to protect our nation's flag from being destroyed!",2020-06-24 10:08:12.805328
Steve Daines,"Totally agree, @realDonaldTrump. We must pass my constitutional amendment to protect our nation's flag from being destroyed!

https://t.co/l6DBh9e4eO",2020-06-24 10:19:07.745287
ChuckGrassley,Appeals ct order 2 dismiss bogus case vs Lt Gen Flynn is impt step 2restoring justice after clear record of DOJ/FBI attempt 2not only frame him but also cover it up/hide exculpatory info during yrs of litigation then judge tried to keep it going This abuse must never happen again,2020-06-24 10:19:51.230490
Lindsey Graham,"It appears the French Revolution has now come to the Democratic Party based on initial primary results from New York and Kentucky.

If you had any doubts about who is in charge of the Democratic Party ALL doubts should have been removed.",2020-06-24 10:21:40.486473
Senator Jerry Moran,"GOOD NEWS: The @US_EDA awarded $400K from the CARES Act to the Mid-America Regional Council.
 
This grant invests resources into the KC area to rebuild the economy, reopen businesses &amp; help those out of work receive the training &amp; skills they need to find meaningful employment.",2020-06-24 10:22:48.848227
Cory Gardner,I spoke with @CBSDenver about the bipartisan effort I am supporting in the Senate to declare #Juneteenth a federal holiday. Watch here ⬇️ https://t.co/qqG5t5DiA5,2020-06-24 10:28:24.290393
"Bill Cassidy, M.D.","As a doctor, I know one-size-fits all, bureaucrat run health care systems lead to worse outcomes for patients. We need to give patients the power and ability to decide what care is best for them and their families. https://t.co/63NBH9lhIE",2020-06-24 10:31:05.499130
Tim Scott,"Total misinformation right here. The House bill does the same thing on chokeholds for state and local police as the #JUSTICEAct. The House bill doesn’t ban state/local no knocks. Federal bans wouldn’t have saved Mr. Garner or Ms. Taylor.

Now - lets vote to debate the #JUSTICEAct",2020-06-24 10:36:15.249854
Senator Rand Paul,"When dissent is disallowed, which of our freedoms is next?

Defund the Thought Police | RealClearPolitics https://t.co/8hOkdZZGsQ",2020-06-24 10:36:46.686768
Senator Todd Young,"#ICYMI: I visited the RV/MH Hall of Fame &amp; Northern Indiana Event Center to discuss the Great American Outdoors Act supporting 140,000 Hoosier jobs linked to outdoor recreation &amp; our parks: @IndianaDunesNPS, @LincolnBoyhood, @GeorgeRClarkNPS, &amp; @HoosierNF. https://t.co/SAH1Kx3ICv",2020-06-24 10:42:38.025852
Tim Scott,"Ahead of today's vote, I offered to include an amendment for every concern that was presented. They didn’t stick around for that meeting. This vote is an opportunity to say yes to those folks who are waiting for leadership to stand and be counted. #JUSTICEAct https://t.co/N56EwrSx0V",2020-06-24 11:00:09.915643
Marco Rubio,"Senate democrats are NOT voting to “block” GOP police reforms

They are blocking even beginning the process of voting on changes to it

If in the end they aren’t satisfied with the bill they would still have the votes to stop it

But instead they want the issue for the campaign https://t.co/WKHVDAX0KN",2020-06-24 11:01:23.494661
Senator Mike Rounds,Welcome home! Thank you for your service to our country. We are all proud of you! 🇺🇸 https://t.co/Qu1QoKrv6z,2020-06-24 11:01:36.144665
Senator Rand Paul,"Irony alert. Liberals want to defund the police but then ask “Where’s the police?”  

“Where’s The Police When You Need Them”: D.C. Delegate Asks The Right Question After Bizarre Incident Near White House – JONATHAN TURLEY https://t.co/DWGdYYioCR",2020-06-24 11:01:38.464237
Senator Mike Crapo,"The pandemic has shut down many of the tourist sites in Washington, D.C. At this time of year, I am generally welcoming dozens of Idahoans to my Washington, D.C., office. (1/4)",2020-06-24 11:04:36.954226
Marco Rubio,#Iran is literally stealing the Gold reserves of the people of #Venezuela by selling gasoline to an oil rich country at a grossly inflated price.,2020-06-24 11:09:48.042418
Tim Scott,Voting on the #JUSTICEAct has now begun.,2020-06-24 11:19:47.540527
Sen. Marsha Blackburn,"Under @realDonaldTrump, the Senate has confirmed 200 judges. We will not stop confirming judges until every vacancy is filled! https://t.co/F8Nq9mlZFd",2020-06-24 11:21:03.908629
Sen. Lamar Alexander,"To submit recommendations in response to my White Paper: “Preparing For the Next Pandemic,” please email PandemicPreparedness@help.senate.gov by 5PM ET on June 26. 

You can read the report and foreword by @bfrist here: https://t.co/Hdejl3DIg5 https://t.co/VdkcvPYILk",2020-06-24 11:22:05.520235
Senator Roger Wicker,"Cory Wilson is a highly-qualified judge who will be a credit to the nation and to his native Mississippi. As the 200th confirmed federal judge during the Trump administration, Judge Wilson appropriately represents the generational transformation of our courts. https://t.co/VQEhLy4zxM",2020-06-24 11:23:14.057316
Leader McConnell,"The Senate has confirmed 200 of President Trump’s nominees to lifetime appointments on the federal bench. With today's confirmation, not a single circuit court vacancy exists anywhere in the nation for the first time in at least 40 years. https://t.co/BvIEuJ62l7",2020-06-24 11:23:20.429783
Senator Mike Rounds,This record-breaking number of confirmations is especially notable since the judges we’ve confirmed will serve lifetime appointments to the federal judiciary. The court decisions they make can have a lasting impact on the direction of our country. https://t.co/cunvUZ8nfQ,2020-06-24 11:29:53.613265
Team Cornyn,"An incredible accomplishment!

The conservative transformation of our courts will be President Trump’s single greatest legacy.",2020-06-24 11:31:30.933637
Sen. Jim Inhofe,"Today marks the 200th federal judicial confirmation under @realDonaldTrump— a number not yet achieved by any sitting president at this stage in four decades. 
 
Very pleased to see his great success in re-making the bench with judges that will uphold the Constitution.",2020-06-24 11:32:44.737833
Senator Kelly Loeffler,"Democrats’ games - placing blame, throwing tantrums &amp; ignoring the consequences of their calls to defund police - MUST end.

Why won't they come to the table &amp; have an honest debate about an issue they say they care about?

Bring the #JUSTICEAct to the floor. https://t.co/VVhjKubfM3",2020-06-24 11:37:22.438382
Sen. Jim Inhofe,"Today marks the 200th federal judicial confirmation under 
@realDonaldTrump— a number not yet achieved by any sitting president at this stage in four decades. 
 
Very pleased to see his great success in re-making the bench with judges that will uphold the Constitution. https://t.co/3NksufxbBR",2020-06-24 11:39:42.420551
Senator Mike Rounds,The record-breaking number of judges we’ve confirmed under President Trump is especially notable since the judges we’ve confirmed will serve lifetime appointments to the federal judiciary. The court decisions they make can have a lasting impact on the direction of our country. https://t.co/iOgBDNFuya,2020-06-24 11:42:31.271883
Richard Shelby,The Senate just confirmed @POTUS’s 200th judicial nominee. These judges will positively impact our judicial system &amp; our country for generations to come – providing impartiality &amp; fairness. Looking forward to even more progress as we continue on this path. https://t.co/xt0TB7iPeF,2020-06-24 11:45:24.949408
Sen. Lamar Alexander,To tear down Andrew Jackson’s statue would be a terrible misunderstanding of our nation’s history.,2020-06-24 11:49:12.275251
ChuckGrassley,Senate Democrats just blocked even debating police reform bill stopping their opportunity to improve the bill by amendment process &amp; then decide if they support it Dems must wake up to the calls from the American ppl for action &amp; stop putting party politics over progress!!,2020-06-24 12:02:42.372627
Leader McConnell,Democrats just blocked the Senate from even considering police reform. They threatened to do this unless I let them short-circuit the amendment process and rewrite @SenatorTimScott’s bill behind closed doors. This issue deserved better than more do-nothing Democratic theatrics.,2020-06-24 12:09:17.437130
Tim Scott,Senator Scott is speaking on the floor now. Tune in at the link - https://t.co/FXistJcrQ9,2020-06-24 12:09:18.531756
Lindsey Graham,I am bitterly disappointed by the fact that Senate Democrats will not even allow debate on #policereform.,2020-06-24 12:09:18.790456
Senator John Thune,"Unbelievable. Dems just blocked the Senate from debating police reform.
Democrats have totally exposed their real motives (it’s not creating change or finding viable solutions). Americans are calling out for justice, equality, &amp; ACTION. But Dems are just focused on politics. Wow.",2020-06-24 12:10:19.148663
Senator Todd Young,"The Senate just confirmed @POTUS’ 200th federal judge, Cory T. Wilson. With 200 judges confirmed in under 3.5 years, the Senate has approved an average of 57 judges per year during the Trump presidency. Filling judicial vacancies helps ensure Americans receive their day in court. https://t.co/p09goiRdcA",2020-06-24 12:40:07.826596
John Kennedy,It was an honor to introduce Louisiana native Peter Thomson to the Senate Intel Committee today. Peter’s integrity and intelligence make him just what we want in a CIA Inspector General. https://t.co/kHoDVox1Ui,2020-06-24 12:43:09.962668
Martha McSally,The Special Diabetes Program for Indians is saving lives. It’s time to pass our bill to reauthorize this critical program.,2020-06-24 12:44:38.947005
Joni Ernst,"Most of the provisions in the #JUSTICEAct are reforms that all of us—Democrats and Republicans—can agree on.
 
Why on earth would my colleagues across the aisle simply say we’re not going to do it? They’re standing in the way of progress. Americans deserve better.",2020-06-24 12:48:07.893816
Sen. Susan Collins,My statement on the Senate's vote today on the JUSTICE Act: https://t.co/N3XEaGMF5J,2020-06-24 12:49:34.619419
Senator Roger Wicker,".@SenatorTimScott has been working tirelessly to get @SenateDems' support for his #JUSTICEACT, which would improve policing in our country. But @SenSchumer won't even agree to bring the bill up for a discussion!",2020-06-24 12:52:35.556592
Sen. Marsha Blackburn,"The deep state has been persistent in its efforts to take down @GenFlynn. 

Today’s decision ordering the dismissal of charges against him is proof that justice will ultimately prevail. @SidneyPowell1",2020-06-24 12:52:49.064416
Sen. Jim Inhofe,I am outraged that Senate Democrats are refusing to even allow us to debate the JUSTICE Act. It’s even more proof that the Democrats aren’t interested in policy or governing – they are only concerned about politics. https://t.co/DMrE15Lshv,2020-06-24 12:56:03.832115
Senator Kelly Loeffler,Democrats have chosen politics over the needs of the American people. Sad and shameful.,2020-06-24 13:00:52.788566
Senator Roger Wicker,He will be a credit to the nation and to his native Mississippi.,2020-06-24 13:04:04.482425
Martha McSally,"My prayers are with the family and colleagues of Navajo Nation Police Officer Michael Lee as they mourn his loss. Officer Lee honorably served the Navajo community as a law enforcement officer for nearly three decades.

 https://t.co/TkJkMYroXZ",2020-06-24 13:08:05.479069
Shelley Moore Capito,"Democrats would rather score political points than work together to make a law. We invited them to debate where our ideas differ, and they just walked away. Pathetic and sad.",2020-06-24 13:13:24.118414
Mike Lee,Consensus on police reform cannot be found behind closed doors. Senate Democrats voted against debating reform today and the country is worse for it. Let’s bring a bill to the floor and debate and amend it until we’re ready to vote on the final product.,2020-06-24 13:13:28.708996
David Perdue,"Debate. Amend. Compromise.
 
In times like these, it’s our duty to come together, to find common ground, and to fight for what’s right.
 
And yet... only TWO Democrat senators voted to begin debating #JUSTICEAct. https://t.co/ErlKLTfpLh",2020-06-24 13:14:57.201904
Shelley Moore Capito,HAPPENING NOW: I’m speaking on the Senate floor. Watch live here: https://t.co/IfgCRvM19Z,2020-06-24 13:30:50.189611
Sen. Dan Sullivan,"#ICYMI, I sat down for an interview in Fairbanks with Ramzi Abou Ghalioum on @KTVF11 to discuss a wide range of important topics, including #COVID19, policing reform, the Alaska economy, and significant new military construction projects for our state. Take a look. https://t.co/XbDTx8RV32",2020-06-24 13:31:25.577782
Cory Gardner,Read my full statement on partisan loyalists blocking debate and consideration of the police reform bill from moving forward. ➡️ https://t.co/LKOeKXHUQK https://t.co/a1h2XXqpKn,2020-06-24 13:32:27.838906
Sen. Kevin Cramer,Democrats have made a political calculation that they will benefit more from chaos than solutions.,2020-06-24 13:33:14.240925
Sen. Kevin Cramer,Everyone should listen to @SenatorTimScott's speech and decide for themselves whether to believe the nonsense coming from @SenateDems.,2020-06-24 13:40:44.289805
Senator Mike Rounds,"Thank you, @SenatorTimScott, for your leadership. This fight is not over.",2020-06-24 13:42:05.819074
Senator Kelly Loeffler,"The safety of American citizens should not be politicized.

Yet, here we are. Mob rule in communities across America, and Democrats turning a blind eye to instead focus on blocking a commonsense, thoughtful and EFFECTIVE solution in the #JUSTICEAct.
 
This is wrong. https://t.co/r3oS1bmlnG",2020-06-24 13:44:53.934122
Shelley Moore Capito,"My thoughts on Democrats’ move to 
block the #JUSTICEAct: https://t.co/4Fm02xMpvC",2020-06-24 13:49:55.608018
Sen. Marsha Blackburn,".@AmbassadorRice orchestrated a plot to take down the @realDonaldTrump campaign and @GenFlynn. 

Rice abused her power to further her leftist agenda. 

Today’s ruling highlights the importance of our system of checks and balances.",2020-06-24 13:53:46.759179
Martha McSally,"We're filling the courts with well-qualified judges at a historic rate. Today, I voted to confirm the 200th federal judge nominated by @POTUS, leaving 0 circuit court vacancies for the 1st time in at least 4 decades.
 
This means swifter justice for Americans. https://t.co/mMf0Koi8uj",2020-06-24 13:55:13.119512
Senator John Thune,"I was hoping that Senate Democrats would put politics aside and work with @SenateGOP to pass a bipartisan police reform bill. Sadly, that did not happen. Democrats just blocked even debating @SenTimScott’s #JUSTICEAct. Talk is cheap. Our job is to legislate. America wants action. https://t.co/AhorpUq5P5",2020-06-24 13:55:59.374563
Joni Ernst,"A strong U.S. — Israel relationship is important to Iowa, and our country, &amp; I’ve been proud to work with the Trump Admin to further our partnership with the nation &amp; its people. 
 
I support @realDonaldTrump’s Vision for Peace and its continued implementation. https://t.co/FeEhrnl8GB",2020-06-24 14:06:48.378549
Team Cornyn,"#200judges - Trump hasn’t simply given lots of lifetime appointments to lots of lawyers. He’s filled the bench with some of the smartest, and some of the most ideologically reliable, men and women to be found in the conservative movement. 

https://t.co/oOqMngbYrH",2020-06-24 14:10:52.517259
Rob Portman,The fact that Senate Democrats voted to block debate and an open amendment process on meaningful police reforms is outrageous and unacceptable.,2020-06-24 14:15:16.810959
Senator Jerry Moran,"Hosted McPherson community leaders yesterday for a virtual meeting &amp; discussed: 

🏬#PPP keeping businesses open &amp; Kansans employed

💻@Mac_College's hybrid learning plan for the fall

👥How the community pulled together to support one another

Thanks to all those that joined!",2020-06-24 14:16:00.704546
ChuckGrassley,Democrats blocked opening debate on police reform preventing chance to offer amendments &amp; publicly negotiate. Sen Tim Scott offered to work with Dems on amendments they say they want but they said no. Now they demand to negotiate behind closed doors Not how Senate should work,2020-06-24 14:25:44.790831
Sen. Kevin Cramer,"Joined Senator @JohnCornyn in introducing the SAVE Jobs Act, a bill to help protect energy businesses and workers by providing administrative clarity and regulatory relief.",2020-06-24 14:30:15.653251
Sen. Lamar Alexander,"I voted to begin debate on @SenatorTimScott’s JUSTICE Act because it will make police officers more accountable, encourage departments to ban chokeholds and adopt best practices, provide better training to police officers, and make lynching a federal crime.",2020-06-24 14:35:26.164047
Senator Pat Roberts,"Great news for soldiers in Kansas and across the country as @USArmy announced today their goal to hire roughly 10,000 full-time and part-time soldiers during the Army National Hiring Days campaign from June 30 – July 2.",2020-06-24 14:36:11.982790
Senator Pat Roberts,"Great news for soldiers in Kansas and across the country as @USArmy announced today their goal to hire roughly 10,000 full-time and part-time soldiers during the Army National Hiring Days campaign from June 30 – July 2.",2020-06-24 14:37:14.179334
Lindsey Graham,"With the confirmation of Cory T. Wilson the Republican-controlled Senate has confirmed 200 federal judges appointed by President Trump. 
 
Almost 1 out of every 5 federal judges throughout the country today are Trump nominees.",2020-06-24 14:37:21.230693
Senator Mike Rounds,"Quick Update on the Senate this week:
➡️ Confirmed the 200th federal judge nominated by President Trump
➡️ Senate Democrats blocked police reform legislation
➡️ Begin consideration of the National Defense Authorization Act by the full Senate https://t.co/crxUE25yY8",2020-06-24 14:37:51.430801
Senator Todd Young,President Trump is right: we must address border security. I’ll be speaking on the Senate Floor shortly about @POTUS’ visit to Yuma this week &amp; the need for action to address the humanitarian crisis and national security threat at our border. https://t.co/zH7NcFUbJG,2020-06-24 14:40:33.088819
Sen. Marsha Blackburn,"We will protect our statues and the rule of law! 

Thank you @realDonaldTrump. https://t.co/WwivzWbyh1",2020-06-24 14:43:47.304165
Cory Gardner,"Today the @FCC commissioners unanimously agreed – S. 2661, my bipartisan bill with @SenatorBaldwin, @TeamMoulton and @RepChrisStewart to create the #988SuicideHotline is critical legislation that will help save lives and the House of Representatives should pass it without delay. https://t.co/xpehKzPVlr",2020-06-24 14:44:04.612840
Rob Portman,"Pleased to join the Dayton Development Coalition’s virtual fly-in &amp; discuss the federal response to the #COVID19 pandemic &amp; the numerous wins for Wright-Patterson Air Force Base in the 2021 NDAA. These victories will benefit not only Wright-Patt, but the entire Dayton community.",2020-06-24 14:44:08.822578
David Perdue,"NEW → The U.S. Senate has now confirmed 200 federal judges under President @realDonaldTrump.

These judges will have an impact on the judiciary for years to come. https://t.co/NnB5dtXb4d",2020-06-24 14:45:23.624122
Tim Scott,"I spoke for a little while earlier today on the #JUSTICEAct. 

https://t.co/fbhSknYJwr",2020-06-24 14:50:29.925583
Sen. Lisa Murkowski,"Over the past several months, it has become clear that domestically we don’t produce enough of the goods we rely on, including crucial medical items. But it also extends to a much wider range of health care, electronic, industrial, defense, and energy technologies. https://t.co/WdFU61AVv9",2020-06-24 14:51:22.245943
Senator Mike Rounds,The VA’s Native American Direct Loan program was established to provide Native American veterans living on trust land with an accessible home loan option. We’re continuing to work with our partners in SD to make sure the program does what it was intended to do. https://t.co/p2Zrp3Hb5C,2020-06-24 14:57:42.793672
Senator John Thune,"Proud to work w/ @SenBrianSchatz to hold internet companies accountable &amp; increase transparency in how platforms decide what info is (or is not) shared w/ their billions of users. Our bill, the #PACTact, would strengthen online transparency, accountability, &amp; consumer protection.",2020-06-24 14:58:05.118113
Team Cornyn,Let's win -- and win BIG -- in November! #KeepTexasRed,2020-06-24 14:58:05.501345
Rob Portman,"Americans want to see progress on meaningful police reform. The #JUSTICEAct would help improve law enforcement through better training, increased transparency &amp; stronger accountability. 

I hope my Dem colleagues will stop blocking debate on this important bill.",2020-06-24 15:04:05.354547
Lindsey Graham,"After today’s floor speech, I’ve never been more proud of my friend and colleague @SenatorTimScott.
 
Tim explained with passion why we should be moving forward to debate police reform.",2020-06-24 15:07:23.036634
Sen. Dan Sullivan,"I’ll be back with another virtual town hall this Thursday evening, June 25, from 5:00-6:00pm AKDT, again joined by @LisaMurkowski. Looking forward to taking your questions and hearing your perspective! To join us, register at: https://t.co/a7W0UegfQF https://t.co/zLMf5waLbL",2020-06-24 15:09:13.403029
Senator Mike Braun,"Proud to support @SenatorTimScott’s #JUSTICEAct and I was the first Republican to offer a solution to reform qualified immunity, but that wasn’t good enough for Democrats and Chuck Schumer who are more focused on politics than solutions that can heal our country.",2020-06-24 15:11:18.659526
Tom Cotton,"Special prosecutor teams should be instruments of justice serving the public--not political weapons used to take down opponents. 

It's time to take the politics out of these investigations. 

https://t.co/FSWHjltgjA",2020-06-24 15:18:29.433924
Senator Ron Johnson,"Preparing for today's senate hearing on the Strategic National Stockpile, I assumed we'd be able to quickly obtain the list of items that should be held there. We quickly found out that those lists do not exist, or certainly are not made available to Congress or the public.",2020-06-24 15:20:42.681310
Joni Ernst,"In Iowa, our legislature put politics aside and passed police reform legislation unanimously. We need more of Iowa in Washington. https://t.co/QKE9nq9jXi",2020-06-24 15:25:05.590040
Richard Shelby,Disappointed my Democratic colleagues blocked us from even considering or debating the #JUSTICEAct. This bill is the proper vehicle for us to quickly pass meaningful reforms to help all Americans feel safe &amp; protected in their communities.,2020-06-24 15:25:46.133969
Senator Mike Crapo,"Thank you @AARPIdaho for inviting @governorLittle, Director Jeppesen of @IDHW and me for a Live Q and A on the #CoronavirusPandemic https://t.co/qUpTQ3oG85",2020-06-24 15:30:57.882245
Shelley Moore Capito,HAPPENING NOW: I’m on @FoxNews discussing the #JUSTICEAct. Watch here: https://t.co/YIOWjMDDFd https://t.co/hOcwHaKNbO,2020-06-24 15:31:27.954510
"Bill Cassidy, M.D.",Competition has led to major technological advances to bring affordable access to health care through telehealth during the COVID19 Pandemic. We can use what we learned during this outbreak &amp; the power of competition to improve our health care system going forward,2020-06-24 15:42:35.503214
Sen. Marsha Blackburn,"On Jan 4, 2017, @FBIWFO recommended closing the investigation into @GenFlynn.     
 
But a top official intervened.
 
The next day, @BarackObama, @JoeBiden &amp; their deep state minions @Comey, @SallyQYates &amp; @AmbassadorRice huddled to brainstorm the best tactics to take down Flynn.",2020-06-24 15:47:56.674160
Shelley Moore Capito,“We have people on the streets of every town in America begging us to do something positive to help the situation. And today? Crickets. Nothing.” The Senate had the chance to begin real change today. Democrats just walked away. My full remarks from the Senate floor: https://t.co/rAr3hUqbcK,2020-06-24 15:51:58.097124
Cory Gardner,"Read my op-ed with Fort Collins Mayor @WadeTroxell in the @coloradoan on why the bipartisan Great American @OutdoorsAct is a historic chance for conservation and also an opportunity to help Colorado recover from #COVID19.
https://t.co/N49bUUHTxP",2020-06-24 15:57:27.006136
