Senator John Thune,"If Senate Democrats prevent us from debating, amending, or voting on the #JUSTICEact this week, they’re doing more than blocking @SenatorTimScott’s bill, they’re blocking an open, bipartisan debate on policing reform – something nearly all of them have said they support. https://t.co/slcMhIGiHf",2020-06-23 13:59:20.449247
Senator Rand Paul,"One lesson from the COVID 19 pandemic, the FDA needs to allow more freedom to diagnostic labs to develop testing

Congress should rein in the FDA | TheHill https://t.co/iBL80Xi2Nc",2020-06-23 14:00:04.441043
Tim Scott,"Happy Nursing Assistants Week!
My mother was a nursing assistant for more than 30 years. We are blessed to have people responsible for the most vulnerable in our society, especially during the COVID-19 pandemic. We honor you all for your sacrifice and hard work. #TwoWithTim https://t.co/haBTxpnnks",2020-06-23 14:04:52.193538
Sen. Jim Inhofe,".@DeptofDefense has chosen Oklahoma’s very own @Team_Tinker, alongside only 10 other U.S. military installations, as one of the military's 5G testing beds.

Looking forward to seeing the great work Tinker conducts as they lead the field in 5G technology. 

https://t.co/NBBRXH3cJR",2020-06-23 14:09:14.237878
Mike Enzi,"COVID-19 outbreaks among employees caused meat processing facilities to slow down production, leaving ranchers with excessive livestock and consumers with either empty grocery shelves or overpriced products.",2020-06-23 14:15:50.865810
Senator Mike Braun,"Sen. Mike Braun, who is unveiling a bill to scale back the Qualified Immunity Act shielding officers from facing personal liability for actions taken in the line of duty, said Tuesday he thinks the law needs to be reformed, not eliminated.
https://t.co/kOzgXhuZKa",2020-06-23 14:18:03.210940
Senator Mike Braun,"It's terrible that Democrats have said they will block debate on the #JUSTICEAct. I think if they do that it's simply to keep Senator Tim Scott and the GOP from moving some basic reforms in place. 

More on that &amp; my qualified immunity reform bill, @dailybriefing w/ @DanaPerino: https://t.co/76QOev45lc",2020-06-23 14:28:41.196802
Senator Kelly Loeffler,"Our farmers &amp; ranchers need help.
 
Grown in the USA, the final pillar of my USA RISE Plan, provides a framework to strengthen American agriculture and help farmers and ranchers - those who work tirelessly to feed &amp; clothe America - RISE above the challenges of this pandemic. https://t.co/YleMKIz0SM",2020-06-23 14:35:52.411067
Cory Gardner,"The Senate passed my bipartisan #988SuicideHotline bill last month, but we still need the House to act before we can make it easier for people in a mental health crisis to receive help. I'm calling on the House to pass it without any further delay.
https://t.co/vvDIrYZyr0",2020-06-23 14:51:49.142894
Shelley Moore Capito,Be sure to check this out on Thursday! https://t.co/ftazXrvPLF,2020-06-23 14:52:45.977201
Cindy Hyde-Smith,"I'm glad to see this event is continuing and is following the proper safety guidelines. Pedaling for Hope benefits the Regional Rehab Center and New Albany Main Street. 
https://t.co/SAHI4gxOf0",2020-06-23 15:00:06.091261
Senator Rand Paul,"Blocking John Bolton from becoming Sec of State was one of my proudest moments!  I’m sure ⁦@realDonaldTrump⁩, in retrospect, said: “that son of a gun Rand Paul is right - Bolton is nothing but a warmonger, a liar and a loser! 
 https://t.co/SBhnYaFB2s",2020-06-23 15:00:29.642959
"Bill Cassidy, M.D.","Every American should have options and the ability to choose something better when it comes to their health care. Sign up below to help me in the fight to give patient’s, not bureaucrats, the power over their health care. https://t.co/FmbBeTAfqc",2020-06-23 15:07:05.398047
Rob Portman,"China &amp; other foreign adversaries are actively exploiting the lack of transparency in our higher ed system.

New reports that US colleges received $1B+ in anonymous funds from donors in China, Russia, Qatar &amp; Saudi Arabia are just the tip of the iceberg. https://t.co/3SKC5wRqII",2020-06-23 15:10:15.172049
Leader McConnell,"“Equal protection of the laws” means that mayors and governors cannot selectively stand down because they fear the political price for confronting a particular mob.

Maintaining the peace is these leaders’ duty. It is not an option that depends on the lawbreakers’ politics. https://t.co/o37g7EcXkf",2020-06-23 15:10:16.403229
ChuckGrassley,"Sen Scott’s JUSTICE Act is a consensus starting point w many bipartisan bills but he said he’s open to other ideas Senate is supposed 2b deliberative body so bring up amendments, even if controversial, debate &amp;vote Got to vote to open the debate 1st though if serious abt action",2020-06-23 15:15:57.806720
Mike Lee,"The evidence suggests that as early as December 31st, China could have taken reasonable preventative measures to protect the rest of the world from this pandemic. https://t.co/V85yyZlD5i",2020-06-23 15:23:14.945714
Ted Cruz,"Beyond satire. 

Twitter is literally censoring the President of the United States for saying that violent anarchists will not be allowed to take over our nation’s capital &amp; that law enforcement will act to protect public safety.

In Big Tech’s Orwellian world, that’s “abusive.”",2020-06-23 15:24:45.787347
Senator John Hoeven,Joined @SenKevinCramer &amp; @RepArmstrongND in urging @fema Administrator Gaynor to swiftly follow the Army Corps of Engineers’ recommendation to accredit the Williston levee &amp; include it in the agency’s updated flood maps. https://t.co/D2H5h7BT9B,2020-06-23 15:30:30.804752
Thom Tillis,"We’re keeping North Carolina families across our state informed on COVID-19 and our efforts to fight back:

📞  50 Telephone Townhalls

✅  600+ Questions Answered

🎥  77 Media Interviews",2020-06-23 15:42:21.754629
Sen. Marsha Blackburn,"China has really done it this time.

Their decision to lie about the Chinese Coronavirus and hide it from the world resulted in over 100,000 dead Americans.

Today, @senjudiciary held a hearing on my Stop COVID Act to allow Americans to sue China for damages. https://t.co/povVY2v8hv",2020-06-23 15:43:22.921005
Martha McSally,"Great to join @realDonaldTrump to mark 200 miles of our border wall now complete. This system is critical to national security, public health, &amp; stopping deadly drug &amp; human trafficking by cartels. I'll continue working w/ POTUS to secure our border &amp; support our amazing agents. https://t.co/pvSugbZ1I7",2020-06-23 15:43:32.296904
Sen. Lisa Murkowski,I appreciate the administration’s effort to account for Alaska’s critical summer seafood season by exempting food supply chain workers from the suspension of non-immigrant visas- helping keep our seafood industry running &amp; safeguard the food supply in Alaska &amp; across the nation.,2020-06-23 15:47:56.491417
Joni Ernst,"We need to move forward to debate the #JUSTICEAct.

If not, the Dems need to explain to the American people why they don’t want to see police reform, why they don’t want to see transparency, &amp; why they don’t want to see us training our police force to do a better job out there. https://t.co/XiFJ1dUzPh",2020-06-23 15:49:00.287502
ChuckGrassley,Shocked 2learn at lunch abt hateful msgs to Sen Tim Scott our ldr of police reform from ppl who must think somehow a black republican can’t lead this effort bc only democrats r qualified to talk abt race/police reform??? we ALL hv a responsibility to b kind even when we disagree!,2020-06-23 15:49:01.683421
Rob Portman,"The #JUSTICEAct takes responsible steps to improve law enforcement through better training, increased transparency &amp; heightened accountability.

Instead of working together, it appears the Democrats will block the Senate from even debating this bill. That’s entirely irresponsible",2020-06-23 15:53:48.444988
Senator Mike Rounds,Couldn’t agree more! We have introduced legislation that allows high-quality meat products that pass state inspection standards (which are required to be ‘at least equal to’ or better than federal state inspection standards) to be sold across state lines. https://t.co/pNBW5JoTHc,2020-06-23 16:03:23.325460
Rob Portman,"We need to work together to find solutions that address racial disparities &amp; promote stronger communities that treat each other with dignity &amp; respect.

The #JUSTICEAct is an important step forward on police reform, increasing transparency &amp; accountability.https://t.co/axfuVcBEJl",2020-06-23 16:04:15.947187
Josh Hawley,Reform Section 230!,2020-06-23 16:05:01.071267
Sen. Lamar Alexander,".@NIAIDNews Fauci at @EnergyCommerce hearing: “I’ve said to this committee, literally, many times over the many years, that we forget things when we get distant from them… we need to establish a system so we are prepared for future outbreaks.” https://t.co/gYPQ9yBmx8",2020-06-23 16:24:01.453742
Senator Roger Wicker,Chief Master Sgt. JoAnne Bass has served the airmen at Keesler Air Force Base well. I look forward to her historic service as the first female Chief Master Sergeant of the @usairforce. https://t.co/abqHY8QTmf,2020-06-23 16:28:24.215133
Senator Pat Roberts,"During the @GOPHELP hearing today I discussed how our nation can prepare for future threats posed by zoonotic diseases that transfer from animals to humans, like the coronavirus. Learn more here: https://t.co/NN4XGIpHWU",2020-06-23 16:31:37.265758
Sen. Marsha Blackburn,"Over 100,000 Americans have died because of Communist China.
 
They lied about the outbreak and hid it from the world for 51 days.
 
The #CCP must pay for what they’ve done, and my Stop COVID Act will literally force them to do just that. https://t.co/6OVHIp0erA",2020-06-23 16:31:38.423803
Sen. John Barrasso,"Senate Democrats are threatening to filibuster the #JUSTICEAct. This reform bill is serious, significant, substantial &amp; has 70% agreement with the reform bill @SpeakerPelosi has in the House. At minimum, we should debate this bill on the floor of the U.S. Senate. https://t.co/DscWNhnnij",2020-06-23 16:37:20.678826
Tim Scott,"It’s time for my friends on the other side of the aisle to fish or cut bait. Let’s start debate on the #JUSTICEAct, have amendment votes, and get this thing moving. Enough is enough.",2020-06-23 16:38:56.750907
Ted Cruz,"On the latest #Verdict, @mikeleeforutah and I talk about how to make the world's greatest deliberative body more deliberative again: https://t.co/upnz5WyRU0 

And then we deliberate whether or not a 🌭 is a sandwich... Where do you fall?",2020-06-23 16:43:35.169916
Sen. Jim Inhofe,"Attn @SenateDems: Nearly everyone agrees we need to do criminal justice reform. 

@realdonaldtrump took the first key step with his executive order last week. 

We should start debate on @SenatorTimScott’s #JusticeAct, which has many bipartisan priorities.",2020-06-23 16:45:05.595624
John Kennedy,"Opioid abuse has crippled communities in our state, and this $3M will help law enforcement keep these deadly drugs off of Louisiana streets and out of Louisiana homes.
https://t.co/ROFLdhO8UY",2020-06-23 16:50:05.714381
Martha McSally,Arizonans employed by the tourism &amp; hospitality industries have been hit hard by the pandemic. Unemployment in these industries still sits over 35%. My bill will help get those impacted back to work.,2020-06-23 16:52:48.549629
Tim Scott,"Part one of today's floor speech on the #JUSTICEAct:

If we miss the opportunity to debate the underlying issues, all you wind up with is talking points and campaigns. https://t.co/9fluJjxsvK",2020-06-23 16:54:55.239548
Tim Scott,"Part two of today's floor speech on the #JUSTICEAct:

Some would rather run on police reform than accomplishing it. I believe both sides have people to come to the table and solve the issues. Let’s do it. https://t.co/vWF3W7AcQ4",2020-06-23 16:56:20.621478
Senator Roy Blunt,"It’s incredibly disappointing that Senate Dems are threatening to block debate on the #JUSTICEAct. Even Speaker Pelosi has said she would support bringing the House &amp; Senate bills to conference, which would give us the opportunity to work together to get a bill to the president. https://t.co/izgsukxZcy",2020-06-23 16:59:47.265306
Sen. Marsha Blackburn,"Big government has grown out of control. I will not stop fighting for a limited, smaller government. Thank you @FreedomWorks for awarding me with the FreedomFighter award! https://t.co/3sUttBsxKr",2020-06-23 17:03:00.906786
Joni Ernst,"As we safely reopen our state &amp; country, it’s critical our working moms &amp; dads have access to child care. This is something I’ve been working on for some time. Heard from child care providers in Iowa City today about their concerns &amp; how we can continue to support their work. https://t.co/HNoy9fniFa",2020-06-23 17:03:08.471671
Marco Rubio,"Racial disparities must be acknowledged &amp; must be addressed. 
 
But not by giving in to a bunch of crazy radicals that don’t care about racial injustice &amp; who hate &amp; want to destroy America. https://t.co/fS3SpaHiav",2020-06-23 17:18:06.384287
Sen. Lisa Murkowski,"This week, @EPA has taken important and needed action to fulfill a core part of its PFAS Action Plan. Thanks to @EPAAWheeler for taking steps to protect Americans from products containing PFAS as well as supporting companies who have phased out certain PFAS voluntarily.",2020-06-23 17:22:02.876421
Senator Mike Braun,I joined @wolfblitzer on @cnn to discuss why I believe reforming qualified immunity - not eliminating it - is the answer. https://t.co/K9jh3TZali,2020-06-23 17:22:56.718484
Senator Todd Young,Comprehensive police reform and tackling Indiana’s judicial emergency were topics of discussion during today’s GOP leadership press conference. https://t.co/vID9UG7PPE https://t.co/NkLEu5Ad1J,2020-06-23 17:26:47.045759
Joni Ernst,"☎️ SOON: I’m hosting a telephone town hall with @SecWilkie and veterans from across Iowa, starting at 6:05pm CT. Tune-in here: https://t.co/2i4VRPIuOv",2020-06-23 17:48:57.644154
Senator Kelly Loeffler,"BILL DROP: I’m introducing the Gun Owner Privacy Act to ensure firearm owners aren’t unlawfully tracked by the government.
 
Law-abiding citizens should be able to exercise their 2nd Amendment right without overly intrusive government surveillance. This bill makes sure of that.",2020-06-23 17:53:13.948463
Sen. Marsha Blackburn,".@realDonaldTrump has secured our southern border with a 200 mile long wall. Thank you, @POTUS, for keeping illegal aliens out of our country! 🇺🇸

https://t.co/rOf74wiiko",2020-06-23 18:00:26.444944
Josh Hawley,Cancel culture meets #BigTech. Now @instagram is censoring a Christian worship leader who wants to post videos of praise and worship from places where there has recently been unrest. And that doesn’t meet “community standards”? Can’t wait to hear the explanation for this,2020-06-23 18:06:07.361047
Ted Cruz,A fair point.,2020-06-23 18:07:35.451609
Sen. Lisa Murkowski,"This week, @EPA has taken important and needed action to fulfill a core part of its PFAS Action Plan. Thanks to  @EPAAWheeler for taking steps to protect Americans from products containing PFAS as well as supporting companies who have phased out certain PFAS voluntarily.",2020-06-23 18:26:26.477779
Senator Mike Braun,"Sen. Mike Braun, R-Ind., told ""The Daily Briefing"" Tuesday that both parties should find a middle ground on the issue of law enforcement reform after Senate Democrats described a Republican proposal as a ""non-starter.""
https://t.co/gyQrUdqxDK",2020-06-23 18:50:04.974600
Lindsey Graham,The border wall is going up and illegal crossings are going down.,2020-06-23 18:51:19.166213
ChuckGrassley,My Dem colleagues know how the Senate works They know we must approve initial vote on Police Reform b4 they can offer amendments Why block Senate from opening debate unless they prefer political spectacle over actual reform???,2020-06-23 18:55:01.514230
Sen. Marsha Blackburn,"We will not tolerate anarchists tearing down statutes and destroying property. 

We will hold these criminals accountable! https://t.co/O33IaanTVr",2020-06-23 19:04:06.982774
Thom Tillis,By the numbers: How we are keeping concerned North Carolina families informed-&gt; https://t.co/mn2eRFFvsy,2020-06-23 19:06:04.989021
Sen. Dan Sullivan,"Davis Hovey of @KNOM has a great comprehensive look at the progress being made on America’s first deep-draft #Arctic port in Nome, which could soon be authorized by Congress once the Senate considers America’s Water Infrastructure Act.",2020-06-23 19:31:08.898971
Sen. Lisa Murkowski,"As we continue to navigate the impacts of #COVID19 &amp; work to create a safer future for all Americans, I participated in a Senate HELP Cmte hearing focused on lessons learned from the COVID-19 response &amp; the actions Congress should take to improve U.S. pandemic preparedness. https://t.co/wOzXwD9MOC",2020-06-23 19:32:18.972303
Senator Kelly Loeffler,"I’ve intro'd 2 bills focused on GA lives &amp; livelihoods in the long term that would...
 
- make it easier to access health care via telemedicine no matter where a patient lives
- protect patients’ credit from being impacted by surprise medical bills
 
More: https://t.co/nC95pdOmt8",2020-06-23 19:37:13.474506
Sen. Marsha Blackburn,"We will not let Andrew Jackson’s statue be destroyed by anarchists.

@realDonaldTrump has authorized the federal government to arrest anyone who “vandalizes or destroys any monument, statue or other such Federal property in the U.S.”  https://t.co/LU2xeggdtt",2020-06-23 19:48:27.605910
Joni Ernst,"Home builders across our state create jobs and help our communities grow. Today, I spoke with the Home Builders Association of Iowa about how we can help on issues important to them, like increasing job training programs and expanding eligibility for the PPP.",2020-06-23 19:57:34.643909
Martha McSally,"We’re making incredible progress on securing our border! Great visit to the 200th mile of the border wall today with @realDonaldTrump, @dougducey, and @RepDLesko.

📸 Official White House photo by Shealah Craighead https://t.co/Tg3FNViDN1",2020-06-23 20:01:08.589748
Sen. Lisa Murkowski,"The #COVID19 pandemic has shown how delicate our supply chains are, and that should be a wakeup call for all of us. Tomorrow I’m chairing a hearing to discuss the role of mineral supply chains in our economic and national security, and the challenges we face in rebuilding them.",2020-06-23 20:30:54.464980
Rob Portman,"There are a number of problems we have to resolve in our relationship with China - and among the most pressing is their theft of our research and IP, which China has been systematically doing for two decades. 

My Safeguarding American Innovation Act will help stop this. https://t.co/TgLQNsQZsB",2020-06-23 20:56:33.519192
Thom Tillis,Congratulations @cawthornforNC on your victory tonight! I look forward to serving with you and know that you will make the people of Western North Carolina proud,2020-06-23 21:06:41.196673
Joni Ernst,"Whether it’s on my #99CountyTour or over the phone, answering questions directly from Iowans is one of my top priorities. On a call with folks from @LeeCountyEDG, I shared a number of items I’m working on, like increasing access to broadband and supporting our ag community.",2020-06-23 21:10:48.528333
Sen. Lisa Murkowski,"Conducting these integrated bomber training operations out of @EielsonAirForceBase provides @usairforce airmen w/ valuable experience, further strengthens our nation’s defense capabilities, &amp; demonstrates our military’s deployment readiness to respond anywhere in the world.",2020-06-23 21:37:14.275194
Sen. Lisa Murkowski,"Conducting these integrated bomber training operations out of @EielsonAirForce provides @usairforce airmen with valuable experience, further strengthens our nation’s defense capabilities, and demonstrates our military’s deployment readiness to respond anywhere in the world.",2020-06-23 21:38:56.060755
Ted Cruz,"As our country is hideously divided &amp; Dems prepare to filibuster the Justice Act—they want a political issue, not real reform or real civil rights protections—Nancy Pelosi engages in vicious, false race-baiting. 

Media: “yawn....Tear down another statue.”",2020-06-23 23:12:06.742230
Marco Rubio,"Though I thought I had toiled in vain,for nothing and for naught spent my strength,
Yet my right is with the LORD,
my recompense is with my God.

Isaiah 49:4",2020-06-24 05:52:14.709724
Marco Rubio,"Today’s vote in Senate is NOT on GOP police bill

It’s only a vote to begin the process of making changes to the GOP bill

If after these changes are made they still don’t support it the Democrats could still block it

But it looks like they wont even allow that process to begin",2020-06-24 06:03:23.410624
Josh Hawley,"“The Lord is good to all, and his compassion is over all that he has made!” Psalm 145:9",2020-06-24 06:20:55.374858
ChuckGrassley,I worked w Sen Durbin + Dems on landmark First Step Act to improve Americas justice system We didnt always agree+some wanted bill to do more but Dems came to table to get job done We can do same 2day +I hope Dems join the debate DON’T WALK AWAY!,2020-06-24 06:42:18.454469
Senator Mike Braun,"Law and order is so important in this country and it’s being stigmatized by these instances like George Floyd, Rayshard Brooks, Breonna Taylor - in law enforcement’s best interest, we need to find a way to get that accountability so you can do your job and not have the stigma. https://t.co/50cLAMlFPO",2020-06-24 07:06:17.806546
Josh Hawley,"The woke mob cancel culture is out of control, pulling down statutes of Grant, Washington, priests and more. Now Democrats want to unilaterally mandate renaming military bases. Today I’m introducing legislation to stop this madness",2020-06-24 07:09:18.231935
Marco Rubio,"The crazy radicals aren’t angry over racial inequality

They hate America &amp; want to destroy it

Last night in Wisconsin they smashed windows at the statehouse,attacked a state senator &amp; tore down a statue of an abolitionist who died trying to end slavery

https://t.co/DNQkVQvLae",2020-06-24 07:16:14.665749
Tom Cotton,Mob vigilantes cannot go unchecked. They must be prosecuted to the fullest extent of the law. https://t.co/fvA4pbbwRJ,2020-06-24 07:26:37.705377
Martha McSally,"Early detection makes a difference. During Alzheimer’s and Brain Awareness Month, learn the warning signs of Alzheimer’s. https://t.co/giAmWdtsMI.",2020-06-24 08:17:05.380400
Sen. Susan Collins,"The U.S. Senate unanimously passed the Wounded Veterans Recreation Act, legislation I introduced with @SenatorShaheen that would make all veterans who have been injured defending our nation eligible for a free, lifetime entry pass to our national parks.

https://t.co/bCUCOZUXSq",2020-06-24 08:26:22.747125
Sen. Marsha Blackburn,"Big Tech’s “free for all” is over.
 
Every American industry follows standards. So should @Google and @Facebook.
 
All of the evil they do – bullying competitors, suppressing search results, silencing public debate – will face a reckoning soon. https://t.co/23j1qWVqbl",2020-06-24 08:26:32.167475
Tim Scott,The moment is now. #JUSTICEAct https://t.co/cEqg3bLdQZ,2020-06-24 08:35:00.256558
David Perdue,"As #Georgia continues to lead in cybersecurity, @SenatorSinema and I introduced a bipartisan bill to help @DHSgov stay a step ahead of cyber attacks. https://t.co/wHSmGRaCDE",2020-06-24 08:37:47.401647
Joni Ernst,"The Chinese Communist Party has no respect for the law. They will do anything to get a leg up—whether that's stealing sensitive military secrets or letting people die to avoid taking responsibility for the spread of #COVID19. 
 
To allow them to go unpunished would be a travesty. https://t.co/tNjO0Ge71b",2020-06-24 08:52:06.933558
Shelley Moore Capito,"Today in @SenateCommerce, we’re holding an oversight hearing of the @FCC. Watch live starting at 10 a.m.: https://t.co/xLtQkvu3pN https://t.co/7OtSiQBoiJ",2020-06-24 08:54:12.291987
Senator Roger Wicker,"As I told the @supertalk audience this morning, @SenatorTimScott's floor speech from last week on the #JUSTICEact is a can't miss. See it here on YouTube. https://t.co/DuQ20TKDBy",2020-06-24 08:58:58.912743
Senator Ron Johnson,"HAPPENING NOW:  Hearing to discuss the mission of the Strategic National Stockpile, its role in the response to #COVID19 and how we can enhance preparedness efforts in the future. https://t.co/VJ0elc6FNU",2020-06-24 09:05:43.839276
Sen. Marsha Blackburn,"“Then Jesus said, ‘Father, forgive them, for they do not know what they are doing.’ And they divided up His garments by casting lots.”

Luke 23:34",2020-06-24 09:08:02.253053
Senator Mike Rounds,"Today, @SenateDems plan to block debate on the JUSTICE Act, our police reform bill. By blocking this bill, @SenateDems are rejecting:
❌Making lynching a federal crime
❌Providing incentives for departments to ban chokeholds
❌Making improvements to training &amp; hiring of officers",2020-06-24 09:29:48.913560
Team Cornyn,"TOMORROW -- Join Sen. Cornyn for a Tele-Town Hall for a conversation on COVID, re-opening the economy, and so much more. Be certain to RSVP for all necessary information →",2020-06-24 09:41:25.112981
David Perdue,I’ll be speaking on the Senate floor about the #JUSTICEAct at 11:00 AM. Watch live here: https://t.co/IettNM8qZQ,2020-06-24 09:41:43.954881
Shelley Moore Capito,"It's really frustrating Democrats don't even want to debate/offer amendments to the #JUSTICEAct on the Senate floor today. We have the chance to actually DO something, not just talk about doing something.",2020-06-24 09:47:27.307933
